category,fact
Animals,A group of flamingos is called a flamboyance.
Animals,Crows can recognize individual human faces.
Animals,Elephants can communicate using low-frequency sounds over long distances.
Animals,Koalas sleep for much of the day because eucalyptus leaves provide limited energy.
Animals,Mantis shrimp can detect types of light humans cannot see.
Animals,Sea otters often hold hands while resting so they do not drift apart.
Archaeology,Buried artifacts often survive because soil limits exposure to oxygen and weather.
Archaeology,Pompeii was preserved by volcanic ash from the eruption of Mount Vesuvius in AD 79.
Archaeology,Stonehenge was built in several phases over many centuries.
Archaeology,The Rosetta Stone helped scholars decipher Egyptian hieroglyphs.
Astronomy,A day on Venus is longer than a year on Venus.
Astronomy,A year on Mercury is just 88 Earth days.
Astronomy,A year on Mercury lasts only 88 Earth days.
Astronomy,Earth completes one orbit around the Sun in 365 days.
Astronomy,Earth completes one orbit around the Sun in about 365 days.
Astronomy,Jupiter completes one orbit around the Sun in about 11.86 Earth years.
Astronomy,Jupiter has the shortest day of any planet in the Solar System at about 10 hours.
Astronomy,Jupiter has the shortest day of any planet in the Solar System.
Astronomy,Light from the Sun takes about 8 minutes to reach Earth.
Astronomy,Mars completes one orbit around the Sun in 687 Earth days.
Astronomy,Mars completes one orbit around the Sun in about 687 Earth days.
Astronomy,Mercury completes one orbit around the Sun in 88 Earth days.
Astronomy,Mercury completes one orbit around the Sun in about 88 Earth days.
Astronomy,Neptune completes one orbit around the Sun in about 165 Earth years.
Astronomy,Neptune was discovered through mathematical prediction before it was directly observed.
Astronomy,Neptune was the first planet discovered through mathematical prediction before direct observation.
Astronomy,Olympus Mons on Mars is the tallest volcano known in the Solar System.
Astronomy,Saturn completes one orbit around the Sun in about 29.5 Earth years.
Astronomy,Saturn could float in water because its average density is less than water.
Astronomy,Saturn s rings are made mostly of ice particles and rocky debris.
Astronomy,The Milky Way contains hundreds of billions of stars.
Astronomy,The Milky Way galaxy is estimated to contain hundreds of billions of stars.
Astronomy,The Moon moves away from Earth by about 3.8 centimeters per year.
Astronomy,The Moon moves away from Earth by roughly 3.8 centimetres every year.
Astronomy,The observable universe is estimated to be about 93 billion light years in diameter.
Astronomy,The Sun contains about 99.86 percent of the mass of the entire Solar System.
Astronomy,The Sun contains the vast majority of the mass in the Solar System.
Astronomy,Uranus completes one orbit around the Sun in about 84 Earth years.
Astronomy,Venus completes one orbit around the Sun in 225 Earth days.
Astronomy,Venus completes one orbit around the Sun in about 225 Earth days.
Biology,A blue whale’s heart can weigh as much as a small car.
Biology,A single strand of spider silk is exceptionally strong for its weight.
Biology,DNA in a single human cell is about 2 meters long when stretched.
Biology,DNA in a single human cell would measure about two metres if stretched out.
Biology,"Human blood contains red cells, white cells, and platelets."
Biology,"Human bones are stronger, ounce for ounce, than steel."
Biology,Human DNA is organized into 23 chromosome pairs.
Biology,Human lungs contain millions of tiny air sacs called alveoli.
Biology,Human skin is the body’s largest organ.
Biology,Human skin is the largest organ in the human body.
Biology,Humans have five basic senses traditionally listed in biology.
Biology,Humans share a large percentage of their DNA with chimpanzees.
Biology,Octopuses have three hearts and blue blood due to copper-based hemocyanin.
Biology,Octopuses have three hearts and blue blood.
Biology,Photosynthesis converts light energy into chemical energy.
Biology,Photosynthesis converts sunlight into chemical energy in plants.
Biology,Red blood cells do not have a nucleus when fully mature in humans.
Biology,Red blood cells in humans lack a nucleus when mature.
Biology,Some bacteria can survive in environments with intense radiation.
Biology,Some fungi form underground networks that span several kilometers.
Biology,Some jellyfish species can revert to earlier life stages under certain conditions.
Biology,Some species of jellyfish are biologically capable of reverting to an earlier life stage.
Biology,Tardigrades can survive extreme environments including the vacuum of space.
Biology,Tardigrades can survive the vacuum of space.
Biology,The adult human skeleton contains 206 bones.
Biology,The African elephant is the largest land animal.
Biology,The Bats are the only mammals capable of sustained flight.
Biology,The Blue whale is the largest animal known to have lived on Earth.
Biology,The brain consumes about 20 percent of the body's energy.
Biology,The Cheetah is the fastest land animal.
Biology,The Dolphins are highly intelligent marine mammals.
Biology,The Giraffe has the longest neck of any living animal.
Biology,The human body hosts trillions of microorganisms.
Biology,The human brain contains about 86 billion neurons.
Biology,The human brain contains roughly 86 billion neurons.
Biology,The human eye can distinguish millions of different colors.
Biology,"The human heart typically beats over 100,000 times per day."
Biology,The Kangaroo moves primarily by hopping.
Biology,The liver is the largest internal organ in the human body.
Biology,The Octopus has three hearts.
Biology,The Penguins are flightless birds adapted to life in water.
Biology,The Peregrine falcon is the fastest bird during its hunting dive.
Biology,The retina contains photoreceptor cells called rods and cones.
Biology,The small intestine is several meters long in adults.
Biology,Trees can exchange chemical signals through underground fungal networks.
Biology,Whales are mammals and must breathe air.
Biology,Whales are mammals and must surface to breathe air.
Chemistry,Acids and bases can neutralize each other in chemical reactions.
Chemistry,Actinium has atomic number 89 in the periodic table.
Chemistry,Actinium is element number 89 in the periodic table.
Chemistry,Aluminium has atomic number 13 in the periodic table.
Chemistry,Aluminium is element number 13 in the periodic table.
Chemistry,Americium has atomic number 95 in the periodic table.
Chemistry,Americium is element number 95 in the periodic table.
Chemistry,Antimony has atomic number 51 in the periodic table.
Chemistry,Antimony is element number 51 in the periodic table.
Chemistry,Argon has atomic number 18 in the periodic table.
Chemistry,Argon is element number 18 in the periodic table.
Chemistry,Arsenic has atomic number 33 in the periodic table.
Chemistry,Arsenic is element number 33 in the periodic table.
Chemistry,Astatine has atomic number 85 in the periodic table.
Chemistry,Astatine is element number 85 in the periodic table.
Chemistry,Bananas are naturally radioactive due to potassium-40.
Chemistry,Barium has atomic number 56 in the periodic table.
Chemistry,Barium is element number 56 in the periodic table.
Chemistry,Berkelium has atomic number 97 in the periodic table.
Chemistry,Berkelium is element number 97 in the periodic table.
Chemistry,Beryllium has atomic number 4 in the periodic table.
Chemistry,Beryllium is element number 4 in the periodic table.
Chemistry,Bismuth has atomic number 83 in the periodic table.
Chemistry,Bismuth is element number 83 in the periodic table.
Chemistry,Bohrium has atomic number 107 in the periodic table.
Chemistry,Bohrium is element number 107 in the periodic table.
Chemistry,Boron has atomic number 5 in the periodic table.
Chemistry,Boron is element number 5 in the periodic table.
Chemistry,Bromine has atomic number 35 in the periodic table.
Chemistry,Bromine is element number 35 in the periodic table.
Chemistry,Cadmium has atomic number 48 in the periodic table.
Chemistry,Cadmium is element number 48 in the periodic table.
Chemistry,Caesium has atomic number 55 in the periodic table.
Chemistry,Caesium is element number 55 in the periodic table.
Chemistry,Calcium has atomic number 20 in the periodic table.
Chemistry,Calcium is element number 20 in the periodic table.
Chemistry,Californium has atomic number 98 in the periodic table.
Chemistry,Californium is element number 98 in the periodic table.
Chemistry,Carbon has atomic number 6 in the periodic table.
Chemistry,Carbon is element number 6 in the periodic table.
Chemistry,Cerium has atomic number 58 in the periodic table.
Chemistry,Cerium is element number 58 in the periodic table.
Chemistry,Chlorine has atomic number 17 in the periodic table.
Chemistry,Chlorine is element number 17 in the periodic table.
Chemistry,Chromium has atomic number 24 in the periodic table.
Chemistry,Chromium is element number 24 in the periodic table.
Chemistry,Cobalt has atomic number 27 in the periodic table.
Chemistry,Cobalt is element number 27 in the periodic table.
Chemistry,Copernicium has atomic number 112 in the periodic table.
Chemistry,Copernicium is element number 112 in the periodic table.
Chemistry,Copper has atomic number 29 in the periodic table.
Chemistry,Copper is element number 29 in the periodic table.
Chemistry,Curium has atomic number 96 in the periodic table.
Chemistry,Curium is element number 96 in the periodic table.
Chemistry,Darmstadtium has atomic number 110 in the periodic table.
Chemistry,Darmstadtium is element number 110 in the periodic table.
Chemistry,Diamond and graphite are both composed entirely of carbon atoms.
Chemistry,Diamond and graphite are both made entirely of carbon.
Chemistry,Dubnium has atomic number 105 in the periodic table.
Chemistry,Dubnium is element number 105 in the periodic table.
Chemistry,Dysprosium has atomic number 66 in the periodic table.
Chemistry,Dysprosium is element number 66 in the periodic table.
Chemistry,Einsteinium has atomic number 99 in the periodic table.
Chemistry,Einsteinium is element number 99 in the periodic table.
Chemistry,Erbium has atomic number 68 in the periodic table.
Chemistry,Erbium is element number 68 in the periodic table.
Chemistry,Europium has atomic number 63 in the periodic table.
Chemistry,Europium is element number 63 in the periodic table.
Chemistry,Fermium has atomic number 100 in the periodic table.
Chemistry,Fermium is element number 100 in the periodic table.
Chemistry,Flerovium has atomic number 114 in the periodic table.
Chemistry,Flerovium is element number 114 in the periodic table.
Chemistry,Fluorine has atomic number 9 in the periodic table.
Chemistry,Fluorine is element number 9 in the periodic table.
Chemistry,Francium has atomic number 87 in the periodic table.
Chemistry,Francium is element number 87 in the periodic table.
Chemistry,Gadolinium has atomic number 64 in the periodic table.
Chemistry,Gadolinium is element number 64 in the periodic table.
Chemistry,Gallium has atomic number 31 in the periodic table.
Chemistry,Gallium is element number 31 in the periodic table.
Chemistry,Germanium has atomic number 32 in the periodic table.
Chemistry,Germanium is element number 32 in the periodic table.
Chemistry,Gold has atomic number 79 in the periodic table.
Chemistry,Gold is element number 79 in the periodic table.
Chemistry,Gold is highly resistant to corrosion and does not rust.
Chemistry,Gold is so chemically unreactive that it does not rust.
Chemistry,Hafnium has atomic number 72 in the periodic table.
Chemistry,Hafnium is element number 72 in the periodic table.
Chemistry,Hassium has atomic number 108 in the periodic table.
Chemistry,Hassium is element number 108 in the periodic table.
Chemistry,Helium has atomic number 2 in the periodic table.
Chemistry,Helium is element number 2 in the periodic table.
Chemistry,Helium is the second most abundant element in the universe.
Chemistry,Holmium has atomic number 67 in the periodic table.
Chemistry,Holmium is element number 67 in the periodic table.
Chemistry,Hydrogen has atomic number 1 in the periodic table.
Chemistry,Hydrogen is element number 1 in the periodic table.
Chemistry,Hydrogen is the lightest element in the periodic table.
Chemistry,Indium has atomic number 49 in the periodic table.
Chemistry,Indium is element number 49 in the periodic table.
Chemistry,Iodine has atomic number 53 in the periodic table.
Chemistry,Iodine is element number 53 in the periodic table.
Chemistry,Iridium has atomic number 77 in the periodic table.
Chemistry,Iridium is element number 77 in the periodic table.
Chemistry,Iron has atomic number 26 in the periodic table.
Chemistry,Iron is element number 26 in the periodic table.
Chemistry,Krypton has atomic number 36 in the periodic table.
Chemistry,Krypton is element number 36 in the periodic table.
Chemistry,Lanthanum has atomic number 57 in the periodic table.
Chemistry,Lanthanum is element number 57 in the periodic table.
Chemistry,Lawrencium has atomic number 103 in the periodic table.
Chemistry,Lawrencium is element number 103 in the periodic table.
Chemistry,Lead has atomic number 82 in the periodic table.
Chemistry,Lead is element number 82 in the periodic table.
Chemistry,Lithium has atomic number 3 in the periodic table.
Chemistry,Lithium is element number 3 in the periodic table.
Chemistry,Livermorium has atomic number 116 in the periodic table.
Chemistry,Livermorium is element number 116 in the periodic table.
Chemistry,Lutetium has atomic number 71 in the periodic table.
Chemistry,Lutetium is element number 71 in the periodic table.
Chemistry,Magnesium has atomic number 12 in the periodic table.
Chemistry,Magnesium is element number 12 in the periodic table.
Chemistry,Manganese has atomic number 25 in the periodic table.
Chemistry,Manganese is element number 25 in the periodic table.
Chemistry,Meitnerium has atomic number 109 in the periodic table.
Chemistry,Meitnerium is element number 109 in the periodic table.
Chemistry,Mendelevium has atomic number 101 in the periodic table.
Chemistry,Mendelevium is element number 101 in the periodic table.
Chemistry,Mercury has atomic number 80 in the periodic table.
Chemistry,Mercury is element number 80 in the periodic table.
Chemistry,Molybdenum has atomic number 42 in the periodic table.
Chemistry,Molybdenum is element number 42 in the periodic table.
Chemistry,Moscovium has atomic number 115 in the periodic table.
Chemistry,Moscovium is element number 115 in the periodic table.
Chemistry,Neodymium has atomic number 60 in the periodic table.
Chemistry,Neodymium is element number 60 in the periodic table.
Chemistry,Neon has atomic number 10 in the periodic table.
Chemistry,Neon is element number 10 in the periodic table.
Chemistry,Neptunium has atomic number 93 in the periodic table.
Chemistry,Neptunium is element number 93 in the periodic table.
Chemistry,Nickel has atomic number 28 in the periodic table.
Chemistry,Nickel is element number 28 in the periodic table.
Chemistry,Nihonium has atomic number 113 in the periodic table.
Chemistry,Nihonium is element number 113 in the periodic table.
Chemistry,Niobium has atomic number 41 in the periodic table.
Chemistry,Niobium is element number 41 in the periodic table.
Chemistry,Nitrogen has atomic number 7 in the periodic table.
Chemistry,Nitrogen is element number 7 in the periodic table.
Chemistry,Nobelium has atomic number 102 in the periodic table.
Chemistry,Nobelium is element number 102 in the periodic table.
Chemistry,Oganesson has atomic number 118 in the periodic table.
Chemistry,Oganesson is element number 118 in the periodic table.
Chemistry,Osmium has atomic number 76 in the periodic table.
Chemistry,Osmium is element number 76 in the periodic table.
Chemistry,Oxygen has atomic number 8 in the periodic table.
Chemistry,Oxygen is element number 8 in the periodic table.
Chemistry,Oxygen is essential for cellular respiration in most complex life.
Chemistry,Palladium has atomic number 46 in the periodic table.
Chemistry,Palladium is element number 46 in the periodic table.
Chemistry,pH is a measure of the acidity or alkalinity of a solution.
Chemistry,Phosphorus has atomic number 15 in the periodic table.
Chemistry,Phosphorus is element number 15 in the periodic table.
Chemistry,Platinum has atomic number 78 in the periodic table.
Chemistry,Platinum is element number 78 in the periodic table.
Chemistry,Plutonium has atomic number 94 in the periodic table.
Chemistry,Plutonium is element number 94 in the periodic table.
Chemistry,Polonium has atomic number 84 in the periodic table.
Chemistry,Polonium is element number 84 in the periodic table.
Chemistry,Potassium has atomic number 19 in the periodic table.
Chemistry,Potassium is element number 19 in the periodic table.
Chemistry,Praseodymium has atomic number 59 in the periodic table.
Chemistry,Praseodymium is element number 59 in the periodic table.
Chemistry,Promethium has atomic number 61 in the periodic table.
Chemistry,Promethium is element number 61 in the periodic table.
Chemistry,Protactinium has atomic number 91 in the periodic table.
Chemistry,Protactinium is element number 91 in the periodic table.
Chemistry,Radium has atomic number 88 in the periodic table.
Chemistry,Radium is element number 88 in the periodic table.
Chemistry,Radon has atomic number 86 in the periodic table.
Chemistry,Radon is element number 86 in the periodic table.
Chemistry,Rhenium has atomic number 75 in the periodic table.
Chemistry,Rhenium is element number 75 in the periodic table.
Chemistry,Rhodium has atomic number 45 in the periodic table.
Chemistry,Rhodium is element number 45 in the periodic table.
Chemistry,Roentgenium has atomic number 111 in the periodic table.
Chemistry,Roentgenium is element number 111 in the periodic table.
Chemistry,Rubidium has atomic number 37 in the periodic table.
Chemistry,Rubidium is element number 37 in the periodic table.
Chemistry,Ruthenium has atomic number 44 in the periodic table.
Chemistry,Ruthenium is element number 44 in the periodic table.
Chemistry,Rutherfordium has atomic number 104 in the periodic table.
Chemistry,Rutherfordium is element number 104 in the periodic table.
Chemistry,Samarium has atomic number 62 in the periodic table.
Chemistry,Samarium is element number 62 in the periodic table.
Chemistry,Scandium has atomic number 21 in the periodic table.
Chemistry,Scandium is element number 21 in the periodic table.
Chemistry,Seaborgium has atomic number 106 in the periodic table.
Chemistry,Seaborgium is element number 106 in the periodic table.
Chemistry,Selenium has atomic number 34 in the periodic table.
Chemistry,Selenium is element number 34 in the periodic table.
Chemistry,Silicon has atomic number 14 in the periodic table.
Chemistry,Silicon is element number 14 in the periodic table.
Chemistry,Silver has atomic number 47 in the periodic table.
Chemistry,Silver is element number 47 in the periodic table.
Chemistry,Sodium has atomic number 11 in the periodic table.
Chemistry,Sodium is element number 11 in the periodic table.
Chemistry,Sodium reacts violently with water to produce hydrogen gas and heat.
Chemistry,Some metals react violently when they come into contact with water.
Chemistry,Strontium has atomic number 38 in the periodic table.
Chemistry,Strontium is element number 38 in the periodic table.
Chemistry,Sulfur has atomic number 16 in the periodic table.
Chemistry,Sulfur is element number 16 in the periodic table.
Chemistry,Table salt is a compound made of sodium and chlorine ions.
Chemistry,Table salt is a compound made of sodium and chlorine.
Chemistry,Tantalum has atomic number 73 in the periodic table.
Chemistry,Tantalum is element number 73 in the periodic table.
Chemistry,Technetium has atomic number 43 in the periodic table.
Chemistry,Technetium is element number 43 in the periodic table.
Chemistry,Tellurium has atomic number 52 in the periodic table.
Chemistry,Tellurium is element number 52 in the periodic table.
Chemistry,Tennessine has atomic number 117 in the periodic table.
Chemistry,Tennessine is element number 117 in the periodic table.
Chemistry,Terbium has atomic number 65 in the periodic table.
Chemistry,Terbium is element number 65 in the periodic table.
Chemistry,Thallium has atomic number 81 in the periodic table.
Chemistry,Thallium is element number 81 in the periodic table.
Chemistry,The periodic table currently contains 118 confirmed elements.
Chemistry,Thorium has atomic number 90 in the periodic table.
Chemistry,Thorium is element number 90 in the periodic table.
Chemistry,Thulium has atomic number 69 in the periodic table.
Chemistry,Thulium is element number 69 in the periodic table.
Chemistry,Tin has atomic number 50 in the periodic table.
Chemistry,Tin is element number 50 in the periodic table.
Chemistry,Titanium has atomic number 22 in the periodic table.
Chemistry,Titanium is element number 22 in the periodic table.
Chemistry,Tungsten has atomic number 74 in the periodic table.
Chemistry,Tungsten is element number 74 in the periodic table.
Chemistry,Uranium has atomic number 92 in the periodic table.
Chemistry,Uranium is element number 92 in the periodic table.
Chemistry,Vanadium has atomic number 23 in the periodic table.
Chemistry,Vanadium is element number 23 in the periodic table.
Chemistry,Water molecules consist of two hydrogen atoms bonded to one oxygen atom.
Chemistry,Xenon has atomic number 54 in the periodic table.
Chemistry,Xenon is element number 54 in the periodic table.
Chemistry,Ytterbium has atomic number 70 in the periodic table.
Chemistry,Ytterbium is element number 70 in the periodic table.
Chemistry,Yttrium has atomic number 39 in the periodic table.
Chemistry,Yttrium is element number 39 in the periodic table.
Chemistry,Zinc has atomic number 30 in the periodic table.
Chemistry,Zinc is element number 30 in the periodic table.
Chemistry,Zirconium has atomic number 40 in the periodic table.
Chemistry,Zirconium is element number 40 in the periodic table.
Climate,Greenhouse gases trap heat in Earth’s atmosphere.
Climate,Ocean currents help regulate global climate patterns.
Climate,The Sahara was a much greener region during parts of the Holocene.
Computing,Binary code represents data using combinations of 0s and 1s.
Computing,Email predates the modern World Wide Web.
Computing,"Open-source software allows its source code to be inspected, modified, and shared."
Computing,The first programmable electronic computers were developed in the 1940s.
Computing,The term 'bug' in computing became popular long before modern personal computers.
Energy,Nuclear power plants generate electricity from heat produced by fission.
Energy,Solar panels convert sunlight directly into electricity using photovoltaic cells.
Engineering,"Bridges expand and contract with temperature changes, which is why they use expansion joints."
Engineering,Jet engines generate thrust by accelerating exhaust gases backward.
Engineering,The Channel Tunnel runs beneath the English Channel and links the UK with France.
Engineering,The Eiffel Tower can grow taller in summer because metal expands when heated.
Environment,Mangrove forests protect coastlines from erosion and storm surges.
Environment,Peatlands store large amounts of carbon despite covering a small part of Earth’s surface.
Environment,The Amazon rainforest plays a major role in Earth’s carbon and water cycles.
Geography,Africa is the only continent crossed by both the equator and the prime meridian.
Geography,Africa is the second-largest continent by land area.
Geography,Antarctica is the covered largely by ice sheets.
Geography,Antarctica is the largest desert on Earth despite being covered in ice.
Geography,Antarctica is the largest desert on Earth.
Geography,Asia is the largest continent by land area.
Geography,Australia is the smallest continent by land area.
Geography,Canada has the longest coastline of any country.
Geography,Europe is the contains more than 40 countries.
Geography,Greenland is the largest island in the world that is not a continent.
Geography,Lake Baikal is the deepest freshwater lake in the world.
Geography,Lake Baikal is the world’s deepest freshwater lake.
Geography,Mount Everest is the highest mountain above sea level.
Geography,"North America is the contains Canada, the United States, and Mexico."
Geography,Russia spans eleven time zones.
Geography,South America is the home to the Amazon River.
Geography,The Amazon River is one of the largest river systems on Earth.
Geography,The capital city of Argentina is Buenos Aires.
Geography,The capital city of Australia is Canberra.
Geography,The capital city of Austria is Vienna.
Geography,The capital city of Belgium is Brussels.
Geography,The capital city of Brazil is Brasilia.
Geography,The capital city of Canada is Ottawa.
Geography,The capital city of Chile is Santiago.
Geography,The capital city of China is Beijing.
Geography,The capital city of Czech Republic is Prague.
Geography,The capital city of Denmark is Copenhagen.
Geography,The capital city of Egypt is Cairo.
Geography,The capital city of Finland is Helsinki.
Geography,The capital city of France is Paris.
Geography,The capital city of Germany is Berlin.
Geography,The capital city of Greece is Athens.
Geography,The capital city of Hungary is Budapest.
Geography,The capital city of India is New Delhi.
Geography,The capital city of Indonesia is Jakarta.
Geography,The capital city of Ireland is Dublin.
Geography,The capital city of Israel is Jerusalem.
Geography,The capital city of Italy is Rome.
Geography,The capital city of Japan is Tokyo.
Geography,The capital city of Kenya is Nairobi.
Geography,The capital city of Mexico is Mexico City.
Geography,The capital city of Netherlands is Amsterdam.
